{
  "id": "vscode-html-language-server",
  "name": "HTML Language Server",
  "description": "HTML language server extracted from Visual Studio Code",
  "url": "https://github.com/microsoft/vscode/tree/main/extensions/html-language-features",
  "documentSelector": [
    {
      "language": "html"
    }
  ]
}
