{
  "id": "codelldb",
  "name": "CodeLLDB",
  "description": "Debug adapter for Rust and C/C++ via LLDB",
  "url": "https://github.com/vadimcn/codelldb",
  "documentSelector": [
    {
      "language": "ada"
    },
    {
      "language": "arm"
    },
    {
      "language": "arm64"
    },
    {
      "language": "asm"
    },
    {
      "language": "c"
    },
    {
      "language": "c3"
    },
    {
      "language": "cpp"
    },
    {
      "language": "crystal"
    },
    {
      "language": "fortran-modern"
    },
    {
      "language": "fortran"
    },
    {
      "language": "jai"
    },
    {
      "language": "nim"
    },
    {
      "language": "objective-c"
    },
    {
      "language": "objective-cpp"
    },
    {
      "language": "objectpascal"
    },
    {
      "language": "odin"
    },
    {
      "language": "pascal"
    },
    {
      "language": "rust"
    }
  ]
}
